{
  "skill_id": "shared.codegraph-query",
  "agent_role": "shared",
  "description": "Query the CodeGraph index for impact, dependents, definitions, and call graphs instead of scanning files.",
  "version": "0.1.0",
  "status": "draft",
  "entry_documents": ["SKILL.md"],
  "scripts": [],
  "tests": ["tests/test_skill.py"],
  "validation": ["pytest -q tests/"],
  "memory_file": ".memory.md",
  "depends_on": [],
  "enhances": ["shared.lsp-navigate", "developer.patch-proposal", "supervisor.story-contract"],
  "provenance": { "source_story": "", "source_trajectory": "", "created_by": "harness" },
  "failure_signatures": [],
  "last_evaluation": { "passed": 0, "total": 0, "fresh_runs": 0, "pass_rate": 0.0, "at": "" },
  "leakage_audit": "unrun"
}
